{
  "message_type": "event",
  "schema": "ods.ver1.i8_piece_analyzed",
  "schema_version": "1.0",
  "producer": "I8",
  "published_at": "2026-09-23T10:00:02.000Z",

  "payload": {
    "piece_id": "P000003",

    "classification": {
      "id": "RISCO"
    },

    "confidence": 0.56,
    "similarity": 0.61,

    "evidence": {
      "image_url": "/frontend/assets/images/mock-piece-uncertain.png"
    }
  }
}
